<?xml version="1.0" encoding="UTF-8"?>
<xs:schema xmlns:xs="http://www.w3.org/2001/XMLSchema" 
                    targetNamespace="http://www.rothlin.com" 
                    elementFormDefault="qualified" 
                    attributeFormDefault="qualified">
	<xs:element name="people">
		<xs:complexType>
			<xs:sequence>
				<xs:element name="person" maxOccurs="unbounded">
					<xs:complexType>
						<xs:sequence>
							<xs:element name="name" type="xs:string"/>
							<xs:element name="pet" type="xs:string"/>
							<xs:element name="phone" minOccurs="0" maxOccurs="unbounded">
								<xs:complexType>
									<xs:simpleContent>
										<xs:extension base="xs:string">
											<xs:attribute name="location" use="required">
												<xs:simpleType>
													<xs:restriction base="xs:string">
														<xs:enumeration value="home"/>
														<xs:enumeration value="mobile"/>
														<xs:enumeration value="office"/>
													</xs:restriction>
												</xs:simpleType>
											</xs:attribute>
										</xs:extension>
									</xs:simpleContent>
								</xs:complexType>
							</xs:element>
						</xs:sequence>
					</xs:complexType>
				</xs:element>
			</xs:sequence>
		</xs:complexType>
	</xs:element>
</xs:schema>
